"","DATE","PMID","YEAR","IF","JOURNAL","TITLE","AUTHORS","DOI","FULL_JOURNAL_NAME"
"6","2021 Mar","33654293","2021","36.130","Nat Med","Single-cell meta-analysis of SARS-CoV-2 entry genes across tissues and demographics","Muus C*, Luecken MD*, Eraslan G*, Sikkema L*, Waghray A*, Heimberg G*, Kobayashi Y*, Vaishnav ED*, Subramanian A*, Smillie C*, Jagadeesh KA*, Duong ET*, Fiskin E*, Torlai Triglia E*, Ansari M*, Cai P*, Lin B*, Buchanan J*, Chen S*, Shu J*, Haber AL*, Chung H*, Montoro DT*, Adams T, Aliee H, Allon SJ, Andrusivova Z, Angelidis I, Ashenberg O, Bassler K, B'ecavin C, Benhar I, Bergenstrahle J, Bergenstrahle L, Bolt L, Braun E, Bui LT, Callori S, Chaffin M, Chichelnitskiy E, Chiou J, Conlon TM, Cuoco MS, Cuomo ASE, Deprez M, Duclos G, Fine D, Fischer DS, Ghazanfar S, Gillich A, Giotti B, Gould J, Guo M, Gutierrez AJ, Habermann AC, Harvey T, He P, Hou X, Hu L, Hu Y, Jaiswal A, Ji L, Jiang P, Kapellos TS, Kuo CS, Larsson L, Leney-Greene MA, Lim K, Litvinukov'a M, Ludwig LS, Lukassen S, Luo W, Maatz H, Madissoon E, Mamanova L, Manakongtreecheep K, Leroy S, Mayr CH, Mbano IM, McAdams AM, Nabhan AN, Nyquist SK, Penland L, Poirion OB, Poli S, Qi C, Queen R, Reichart D, Rosas I, Schupp JC, Shea CV, Shi X, Sinha R, Sit RV, Slowikowski K, Slyper M, Smith NP, Sountoulidis A, Strunz M, Sullivan TB, Sun D, Talavera-L'opez C, Tan P, Tantivit J, Travaglini KJ, Tucker NR, Vernon KA, Wadsworth MH, Waldman J, Wang X, Xu K, Yan W, Zhao W, Ziegler CGK; NHLBI LungMap Consortium; Human Cell Atlas Lung Biological Network.","10.1038/s41591-020-01227-z","nature medicine"
"7","2020 Dec 15","33296687","2020","22.553","Immunity","Longitudinal Multi-omics Analyses Identify Responses of Megakaryocytes, Erythroid Cells, and Plasmablasts as Hallmarks of Severe COVID-19","Bernardes JP, Mishra N, Tran F, Bahmer T, Best L, Blase JI, Bordoni D, Franzenburg J, Geisen U, Josephs-Spaulding J, K""ohler P, K""unstner A, Rosati E, Aschenbrenner AC, Bacher P, Baran N, Boysen T, Brandt B, Bruse N, D""orr J, Dr""ager A, Elke G, Ellinghaus D, Fischer J, Forster M, Franke A, Franzenburg S, Frey N, Friedrichs A, Fuss J, Gl""uck A, Hamm J, Hinrichsen F, Hoeppner MP, Imm S, Junker R, Kaiser S, Kan YH, Knoll R, Lange C, Laue G, Lier C, Lindner M, Marinos G, Markewitz R, Nattermann J, Noth R, Pickkers P, Rabe KF, Renz A, R""ocken C, Rupp J, Schaffarzyk A, Scheffold A, Schulte-Schrepping J, Schunk D, Skowasch D, Ulas T, Wandinger KP, Wittig M, Zimmermann J, Busch H, Hoyer BF, Kaleta C, Heyckendorf J, Kox M, Rybniker J, Schreiber S, Schultze JL, Rosenstiel P; HCA Lung Biological Network; Deutsche COVID-19 Omics Initiative (DeCOI).","10.1016/j.immuni.2020.11.017","immunity"
"11","2020 Aug 18","32795091","2020","23.603","Circulation","Myocyte-Specific Upregulation of ACE2 in Cardiovascular Disease: Implications for SARS-CoV-2-Mediated Myocarditis","Tucker NR*, Chaffin M*, Bedi KC Jr, Papangeli I, Akkad AD, Arduini A, Hayat S, Eraslan G, Muus C, Bhattacharyya RP, Stegmann CM; Human Cell Atlas Lung Biological Network, Margulies KB, Ellinor PT; Human Cell Atlas Lung Biological Network Consortium Members.","10.1161/CIRCULATIONAHA.120.047911","circulation"
"12","2020 May 28","32413319","2020","38.637","Cell","SARS-CoV-2 Receptor ACE2 Is an Interferon-Stimulated Gene in Human Airway Epithelial Cells and Is Detected in Specific Cell Subsets across Tissues","Ziegler CGK, Allon SJ, Nyquist SK, Mbano IM, Miao VN, Tzouanas CN, Cao Y, Yousif AS, Bals J, Hauser BM, Feldman J, Muus C, Wadsworth MH 2nd, Kazer SW, Hughes TK, Doran B, Gatter GJ, Vukovic M, Taliaferro F, Mead BE, Guo Z, Wang JP, Gras D, Plaisant M, Ansari M, Angelidis I, Adler H, Sucre JMS, Taylor CJ, Lin B, Waghray A, Mitsialis V, Dwyer DF, Buchheit KM, Boyce JA, Barrett NA, Laidlaw TM, Carroll SL, Colonna L, Tkachev V, Peterson CW, Yu A, Zheng HB, Gideon HP, Winchell CG, Lin PL, Bingle CD, Snapper SB, Kropski JA, Theis FJ, Schiller HB, Zaragosi LE, Barbry P, Leslie A, Kiem HP, Flynn JL, Fortune SM, Berger B, Finberg RW, Kean LS, Garber M, Schmidt AG, Lingwood D, Shalek AK, Ordovas-Montanes J; HCA Lung Biological Network. Electronic address: lung-network@humancellatlas.org; HCA Lung Biological Network.","10.1016/j.cell.2020.04.035","cell"
"13","2020 May","32327758","2020","36.130","Nat Med","SARS-CoV-2 entry factors are highly expressed in nasal epithelial cells together with innate immune genes","Sungnak W, Huang N, B'ecavin C, Berg M, Queen R, Litvinukova M, Talavera-L'opez C, Maatz H, Reichart D, Sampaziotis F, Worlock KB, Yoshida M, Barnes JL; HCA Lung Biological Network.","10.1038/s41591-020-0868-6","nature medicine"
